{
  "player_key": "Waddle, Jaylen | MIA | WR",
  "claim_type": "start_sit",
  "stance": "start",
  "reason": "limited Friday; hamstring risk",
  "evidence": "exact snippet or link text",
  "source": {
    "name": "r/fantasyfootball",
    "url": "...",
    "author": "..."
  },
  "timestamp": "2025-08-26T13:40:00Z",
  "confidence": 0.75
}